<?xml version="1.0" encoding="UTF-8"?>
<!DOCTYPE productes SYSTEM "productes.dtd">
<productes>
    <producte>
        <ratoli codi="r01"> sense fil space </ratoli>
    </producte>
    <producte>
        <teclat codi="t03">Teclat de colors </teclat>
    </producte>
    <producte>
        <teclat codi="t04">Teclat de colors </teclat>
        <monitor codi="m100">TÃ ctil</monitor>
    </producte>
</productes>